Parsed test spec with 2 sessions

starting permutation: b1 r1 b2 d2 c2 w1 r1again c1
step b1: BEGIN ISOLATION LEVEL SERIALIZABLE;
step r1: SELECT * FROM test WHERE k = 1;
k|      j
-+-------
1|1000000
(1 row)

step b2: BEGIN ISOLATION LEVEL SERIALIZABLE;
step d2: DELETE FROM test WHERE j = 1000000;
step c2: COMMIT;
step w1: INSERT INTO test VALUES (1, 2);
ERROR:  could not serialize access due to read/write dependencies among transactions
step r1again: SELECT * FROM test WHERE k = 1 ORDER BY j;
ERROR:  current transaction is aborted, commands ignored until end of transaction block
step c1: COMMIT;

starting permutation: b1 r1 b2 d2 c2 w1conflict r1again c1
step b1: BEGIN ISOLATION LEVEL SERIALIZABLE;
step r1: SELECT * FROM test WHERE k = 1;
k|      j
-+-------
1|1000000
(1 row)

step b2: BEGIN ISOLATION LEVEL SERIALIZABLE;
step d2: DELETE FROM test WHERE j = 1000000;
step c2: COMMIT;
step w1conflict: INSERT INTO test VALUES (1, 2) ON CONFLICT DO NOTHING;
ERROR:  could not serialize access due to read/write dependencies among transactions
step r1again: SELECT * FROM test WHERE k = 1 ORDER BY j;
ERROR:  current transaction is aborted, commands ignored until end of transaction block
step c1: COMMIT;

starting permutation: b2 d2 c2 b1 w1 r1again c1
step b2: BEGIN ISOLATION LEVEL SERIALIZABLE;
step d2: DELETE FROM test WHERE j = 1000000;
step c2: COMMIT;
step b1: BEGIN ISOLATION LEVEL SERIALIZABLE;
step w1: INSERT INTO test VALUES (1, 2);
step r1again: SELECT * FROM test WHERE k = 1 ORDER BY j;
k|j
-+-
1|2
(1 row)

step c1: COMMIT;
