Parsed test spec with 3 sessions

starting permutation: s1_begin s1_read s2_begin s2_read s2_write s2_commit s1_write s1_commit
step s1_begin: BEGIN ISOLATION LEVEL SERIALIZABLE;
step s1_read: SELECT count(*) FROM summarized_write_skew WHERE v = 1;
count
-----
    0
(1 row)

step s2_begin: BEGIN ISOLATION LEVEL SERIALIZABLE;
step s2_read: SELECT count(*) FROM summarized_write_skew WHERE v = 1;
count
-----
    0
(1 row)

step s2_write: 
	UPDATE summarized_write_skew
	SET v = 1
	WHERE id = 1
	  AND (SELECT count(*) FROM summarized_write_skew WHERE v = 1) = 0;

step s2_commit: COMMIT;
step s1_write: 
	UPDATE summarized_write_skew
	SET v = 1
	WHERE id = 2
	  AND (SELECT count(*) FROM summarized_write_skew WHERE v = 1) = 0;

ERROR:  could not serialize access due to read/write dependencies among transactions
step s1_commit: COMMIT;

starting permutation: s1_begin s1_read s2_begin s2_read s2_write s2_commit attach summarize detach s1_write s1_commit
step s1_begin: BEGIN ISOLATION LEVEL SERIALIZABLE;
step s1_read: SELECT count(*) FROM summarized_write_skew WHERE v = 1;
count
-----
    0
(1 row)

step s2_begin: BEGIN ISOLATION LEVEL SERIALIZABLE;
step s2_read: SELECT count(*) FROM summarized_write_skew WHERE v = 1;
count
-----
    0
(1 row)

step s2_write: 
	UPDATE summarized_write_skew
	SET v = 1
	WHERE id = 1
	  AND (SELECT count(*) FROM summarized_write_skew WHERE v = 1) = 0;

step s2_commit: COMMIT;
step attach: 
	SELECT injection_points_attach('serializable-summarize', 'notice');

injection_points_attach
-----------------------
                       
(1 row)

s3: NOTICE:  notice triggered for injection point serializable-summarize
step summarize: 
	BEGIN ISOLATION LEVEL SERIALIZABLE;
	SELECT 1;
	COMMIT;

?column?
--------
       1
(1 row)

step detach: 
	SELECT count(*) > 0 AS locks_summarized
	FROM pg_locks
	WHERE mode = 'SIReadLock' AND virtualtransaction = '-1/0';
	SELECT injection_points_detach('serializable-summarize');

locks_summarized
----------------
t               
(1 row)

injection_points_detach
-----------------------
                       
(1 row)

step s1_write: 
	UPDATE summarized_write_skew
	SET v = 1
	WHERE id = 2
	  AND (SELECT count(*) FROM summarized_write_skew WHERE v = 1) = 0;

ERROR:  could not serialize access due to read/write dependencies among transactions
step s1_commit: COMMIT;
